account_name_level,level,balance,account_name,account_description,account_type,financial_statement_type
Assets,1,-,Assets,"{""what_it's_for"": ""Assets represent the resources owned by a company that are expected to provide future benefits. These can be tangible or intangible and are used in the company's operations."", 'main_industries': 'All industries use assets, including but not limited to manufacturing, retail, services, technology, and healthcare.', 'regulatory_relationship': 'Assets are regulated by accounting standards boards such as the Financial Accounting Standards Board (FASB) in the U.S. or the International Accounting Standards Board (IASB) globally. They are subject to principles such as the historical cost principle and the matching principle.', 'accounting_standards_information': ""Under both U.S. Generally Accepted Accounting Principles (GAAP) and International Financial Reporting Standards (IFRS), assets are recorded and reported on a company's balance sheet. They are classified as current or non-current depending on their liquidity or how quickly they can be converted into cash.""}",Assets,Balance Sheet
. Unspecified assets,2,-,Unspecified assets,"{'what_it’s_for': ""This account is used for recording assets that do not fit into the specific categories of other asset accounts. It can include a variety of assets that are not specifically listed under a company's standard asset categories."", 'main_industries': 'This account can be used across various industries, particularly those with diverse asset portfolios such as manufacturing, real estate, and technology industries.', 'regulatory_relationship': 'The use of this account should comply with the Generally Accepted Accounting Principles (GAAP) and International Financial Reporting Standards (IFRS), which require that assets be clearly defined and valued.', 'accounting_standards_information': 'Under both GAAP and IFRS, companies are required to disclose the nature of the assets and the reasons why these assets cannot be classified within existing asset categories.'}",Assets,Balance Sheet
. . Unspecified assets,3,-,Unspecified assets,"{'what_it’s_for': ""This account is used for recording assets that do not fit into the specific categories of other asset accounts. It can include a variety of assets that are not specifically listed under a company's standard asset categories."", 'main_industries': 'This account can be used across various industries, particularly those with diverse asset portfolios such as manufacturing, real estate, and technology industries.', 'regulatory_relationship': 'The use of this account should comply with the Generally Accepted Accounting Principles (GAAP) and International Financial Reporting Standards (IFRS), which require that assets be clearly defined and valued.', 'accounting_standards_information': 'Under both GAAP and IFRS, companies are required to disclose the nature of the assets and the reasons why these assets cannot be classified within existing asset categories.'}",Assets,Balance Sheet
. . . Unspecified assets,4,Dr,Unspecified assets,"{'what_it’s_for': ""This account is used for recording assets that do not fit into the specific categories of other asset accounts. It can include a variety of assets that are not specifically listed under a company's standard asset categories."", 'main_industries': 'This account can be used across various industries, particularly those with diverse asset portfolios such as manufacturing, real estate, and technology industries.', 'regulatory_relationship': 'The use of this account should comply with the Generally Accepted Accounting Principles (GAAP) and International Financial Reporting Standards (IFRS), which require that assets be clearly defined and valued.', 'accounting_standards_information': 'Under both GAAP and IFRS, companies are required to disclose the nature of the assets and the reasons why these assets cannot be classified within existing asset categories.'}",Assets,Balance Sheet
. . . Asset clearing,4,Dr,Asset clearing,"{""what_it's_for"": 'An Asset Clearing account is typically used to temporarily hold an amount that will later be moved to another account. It is often used in transactions where the final destination of the account is not known at the time the transaction is made.', 'main_industries': 'This account can be used in a variety of industries, but is particularly common in financial services, real estate, and manufacturing.', 'regulatory_relationship': 'The use of an Asset Clearing account must comply with the Generally Accepted Accounting Principles (GAAP) and International Financial Reporting Standards (IFRS).', 'accounting_standards_information': 'Under both GAAP and IFRS, amounts held in an Asset Clearing account should be properly disclosed and not be held in the account for an unreasonable length of time.'}",Assets,Balance Sheet
. Current assets,2,-,Current assets,"{""what_it's_for"": ""Current assets are short-term economic resources that are expected to be converted into cash or used up within one year or within the entity's normal operating cycle, whichever is longer. They include cash, accounts receivable, inventory, and other short-term assets."", 'main_industries': 'All industries use current assets, but they are particularly important in retail, manufacturing, and any other industry with significant inventory or accounts receivable.', 'regulatory_relationship': 'Current assets are regulated by the Financial Accounting Standards Board (FASB) in the United States and by the International Accounting Standards Board (IASB) internationally. They are subject to various accounting standards, including IFRS and US GAAP.', 'accounting_standards_information': 'Under both IFRS and US GAAP, current assets are presented in order of liquidity on the balance sheet. They are measured initially at cost and subsequently may be measured using either a cost or a revaluation model, depending on the specific type of current asset.'}",Assets,Balance Sheet
. . Cash and cash-equivalent assets,3,-,Cash and cash-equivalent assets,"{""what_it's_for"": 'This account represents the most liquid assets of a company, including currency, negotiable instruments, and undeposited bank funds. It is used for meeting short-term obligations and day-to-day operational expenses.', 'main_industries': 'This account is applicable to all industries, but is particularly important for industries with high liquidity needs such as retail, manufacturing, and financial services.', 'regulatory_relationship': ""This account is subject to regulatory scrutiny as it represents a key indicator of a company's immediate financial health. Misrepresentation can lead to severe penalties."", 'accounting_standards_information': 'This account is governed by both the International Financial Reporting Standards (IFRS) and the Generally Accepted Accounting Principles (GAAP). Both require that cash and cash equivalents be reported separately from other assets.'}",Assets,Balance Sheet
. . . Unspecified cash/deposits,4,Dr,Unspecified cash/deposits,"{'what_it’s_for': ""This account is used to record the company's cash on hand or deposits made into a bank or financial institution. It includes all forms of currency that a company has, including physical money and balances in checking and savings accounts, as well as short-term investments that can easily be converted into cash."", 'main_industries': 'This account is applicable to all industries as cash and deposits are a common part of all business operations.', 'regulatory_relationship': 'This account is regulated by the Financial Accounting Standards Board (FASB) and the International Financial Reporting Standards (IFRS) which require companies to disclose their cash and cash equivalents.', 'accounting_standards_information': 'According to both FASB and IFRS, cash and cash equivalents should be reported on the balance sheet at their fair value.'}",Assets,Balance Sheet
. . . Cash,4,Dr,Cash,"{'what_it’s_for': ""Cash is used to represent the company's liquid assets. It includes physical currency, checks, and balances in checking and savings accounts."", 'main_industries': ""All industries need to manage cash as it is a basic component of a company's financial health."", 'regulatory_relationship': 'Cash management is subject to various regulations depending on the industry and region. For example, companies must comply with anti-money laundering laws and regulations.', 'accounting_standards_information': 'Under both IFRS and US GAAP, cash is reported at its nominal value.'}",Assets,Balance Sheet
. . . Domestic bank deposits,4,Dr,Domestic bank deposits,"{'what_it’s_for': 'This account is used to record the amount of money a company has deposited in domestic banks. It includes all cash available on demand, including bank notes and checking or savings accounts.', 'main_industries': ""This account can be used by all industries, but it's particularly important for industries with high liquidity needs such as retail, manufacturing, and financial services."", 'regulatory_relationship': 'This account is subject to banking regulations and may be insured by the Federal Deposit Insurance Corporation (FDIC) in the United States or similar entities in other countries.', 'accounting_standards_information': 'Under both IFRS and US GAAP, cash and cash equivalents are part of current assets and should be reported at nominal value.'}",Assets,Balance Sheet
. . . Foreign bank deposits,4,Dr,Foreign bank deposits,"{'what_it’s_for': 'Foreign bank deposits refer to the cash deposits held in a bank located outside the home country. These deposits are usually in the currency of the country where the bank is located.', 'main_industries': 'This account is commonly used in industries with international operations such as Manufacturing, Import/Export, Multinational Corporations, and Financial Services.', 'regulatory_relationship': 'Foreign bank deposits are subject to the regulations of the country where the bank is located. They may also be subject to the regulations of the home country, particularly in relation to foreign exchange controls and tax laws.', 'accounting_standards_information': 'Under International Financial Reporting Standards (IFRS) and Generally Accepted Accounting Principles (GAAP), foreign bank deposits are usually classified as monetary items. They are translated into the functional currency at the closing rate.'}",Assets,Balance Sheet
. . . Credit union deposits,4,Dr,Credit union deposits,"{""what_it's_for"": 'Credit union deposits represent the money that individuals or businesses have deposited into a credit union. These funds are used by the credit union to provide loans and other financial services to its members.', 'main_industries': 'This account is primarily used in the banking and financial services industry, specifically by credit unions.', 'regulatory_relationship': 'Credit union deposits are regulated by the National Credit Union Administration (NCUA) in the United States, and similar bodies in other countries. They are also subject to the regulations of the Financial Accounting Standards Board (FASB).', 'accounting_standards_information': 'Under Generally Accepted Accounting Principles (GAAP), credit union deposits are considered liabilities because they represent an obligation of the credit union to return the funds to the depositor upon demand.'}",Liabilities,Balance Sheet
. . . Other cash-like instruments,4,Dr,Other cash-like instruments,"{""what_it's_for"": 'This account is used for recording the value of assets that are highly liquid and can be easily converted into cash. These can include money market funds, treasury bills, commercial paper, and other short-term investments.', 'main_industries': 'This account is commonly used in industries with high liquidity needs such as financial services, investment firms, and large corporations with significant cash reserves.', 'regulatory_relationship': 'The valuation and reporting of these assets are subject to regulations by financial authorities. In the US, for example, they are governed by the Financial Accounting Standards Board (FASB) and Securities and Exchange Commission (SEC).', 'accounting_standards_information': 'Under the Generally Accepted Accounting Principles (GAAP), these assets are typically reported at fair value on the balance sheet.'}",Assets,Balance Sheet
. . Accounts receivable (A/R),3,-,Accounts receivable (A/R),"{""what_it's_for"": 'Accounts receivable (A/R) represents the outstanding invoices a company has or the money clients owe the company. The phrase refers to accounts a business has the right to receive because it has delivered a product or service.', 'main_industries': 'All industries that provide goods or services on credit such as manufacturing, wholesale, retail, and service industries.', 'regulatory_relationship': 'Accounts receivable is regulated under the Generally Accepted Accounting Principles (GAAP) and International Financial Reporting Standards (IFRS).', 'accounting_standards_information': 'Under both GAAP and IFRS, accounts receivable is reported as a current asset on the balance sheet.'}",Assets,Balance Sheet
. . . Unspecified accounts receivable (A/R),4,Dr,Unspecified accounts receivable (A/R),"{""what_it's_for"": 'This account is used to record amounts that are owed to the company by customers for goods or services provided on credit. It is a current asset as it is expected to be collected within a short period of time, typically within a year.', 'main_industries': 'This account is commonly used across all industries, particularly those that offer credit terms to their customers such as retail, manufacturing, and services industries.', 'regulatory_relationship': 'The account is subject to the allowance method for doubtful accounts under the Generally Accepted Accounting Principles (GAAP) and International Financial Reporting Standards (IFRS).', 'accounting_standards_information': 'Under both GAAP and IFRS, companies are required to estimate and record an allowance for doubtful accounts, which is a contra asset account that reduces the total A/R to its net realizable value.'}",Assets,Balance Sheet
. . . Allowance for doubtful accounts receivable (A/R) (contra),4,Cr,Allowance for doubtful accounts receivable (A/R) (contra),"{""what_it's_for"": 'This account is used to estimate the portion of accounts receivable that may be uncollectible. It is a contra-asset account, meaning it reduces the total value of an asset, in this case, accounts receivable.', 'main_industries': 'This account is used across many industries, but is particularly relevant in industries where credit sales are common, such as retail, manufacturing, and services.', 'regulatory_relationship': 'The use of this account is guided by the Generally Accepted Accounting Principles (GAAP) and the International Financial Reporting Standards (IFRS). Both require businesses to estimate and provide for potential losses from uncollectible accounts.', 'accounting_standards_information': 'Under both GAAP and IFRS, businesses are required to use either the direct write-off method or the allowance method to account for uncollectible accounts. The allowance for doubtful accounts is used under the allowance method.'}",Assets,Balance Sheet
. . . Trade accounts receivable (A/R),4,Dr,Trade accounts receivable (A/R),"{""what_it's_for"": 'Trade accounts receivable (A/R) represents the amount of money owed to a company by its customers for goods or services that have been delivered or used but not yet paid for.', 'main_industries': 'This account is used across all industries, but is particularly relevant in retail, manufacturing, and services industries where goods or services are often sold on credit.', 'regulatory_relationship': 'Trade accounts receivable is regulated under the Generally Accepted Accounting Principles (GAAP) and International Financial Reporting Standards (IFRS). It is subject to the matching principle, which requires revenues and their related expenses to be reported in the same period.', 'accounting_standards_information': 'Under both GAAP and IFRS, accounts receivable is recorded at net realizable value, and companies must estimate and record an allowance for doubtful accounts to account for potential losses.'}",Assets,Balance Sheet
. . . Discounts on sales (contra),4,Cr,Discounts on sales (contra),"{""what_it's_for"": 'This account is used to record the discounts given on sales. It is a contra account, meaning it is used to reduce the value of a related account when the two are netted together.', 'main_industries': 'Retail, Manufacturing, Wholesale, E-commerce', 'regulatory_relationship': 'This account is regulated under the Generally Accepted Accounting Principles (GAAP) and International Financial Reporting Standards (IFRS).', 'accounting_standards_information': 'Under both GAAP and IFRS, discounts on sales are recorded as a contra revenue account. This means they reduce the total revenue reported, rather than being reported as an expense.'}",Revenue,Income Statement
. . . Taxes receivable,4,Dr,Taxes receivable,"{""what_it's_for"": 'Taxes receivable is an account that tracks the amount of taxes owed to a company, government, or organization. It represents the amount of taxes that have been assessed, but not yet paid.', 'main_industries': 'This account is primarily used in government sectors, public administration, and in some cases, large corporations with complex tax structures.', 'regulatory_relationship': 'Taxes receivable is regulated by tax laws and accounting standards in each jurisdiction. It is subject to audit and verification by tax authorities.', 'accounting_standards_information': 'Under the Generally Accepted Accounting Principles (GAAP) and International Financial Reporting Standards (IFRS), taxes receivable is recognized when it is probable that the economic benefits will flow to the entity and the amount of the tax can be measured reliably.'}",Assets,Balance Sheet
. . . Interest Receivable,4,Dr,Interest Receivable,"{""what_it's_for"": 'Interest Receivable is an asset account that records the amount of interest that has been earned by investments, loans and other interest-bearing assets, but has not yet been received.', 'main_industries': 'Banking, Financial Services, Investment Firms, Real Estate, Insurance', 'regulatory_relationship': 'Interest Receivable is regulated under the Generally Accepted Accounting Principles (GAAP) and International Financial Reporting Standards (IFRS). It must be reported accurately to avoid regulatory penalties.', 'accounting_standards_information': 'Under both GAAP and IFRS, Interest Receivable is recorded as an asset because it represents a future economic benefit. It is usually reported in the current assets section of the balance sheet because it is expected to be received within one year.'}",Assets,Balance Sheet
. . . Holdbacks Receivable,4,Dr,Holdbacks Receivable,"{""what_it's_for"": 'Holdbacks Receivable is an account that tracks the amount of money to be received from a customer or client, typically in the construction industry. This is often a portion of the total contract price that is held back until the project is fully completed to ensure all work is done to satisfaction.', 'main_industries': 'Construction, Real Estate', 'regulatory_relationship': 'Holdbacks Receivable is regulated under the contract law and specific construction laws in many jurisdictions. It is also subject to the Generally Accepted Accounting Principles (GAAP).', 'accounting_standards_information': 'Under the accrual basis of accounting, Holdbacks Receivable is recorded as an asset when the earnings process is complete, but the cash is yet to be received.'}",Assets,Balance Sheet
. . . Leases Receivable,4,Dr,Leases Receivable,"{""what_it's_for"": 'Leases Receivable is an account that represents the amount of money a lessor is owed by lessees for lease contracts. It is the present value of lease payments yet to be received under the terms of a lease agreement.', 'main_industries': 'Real Estate, Equipment Leasing, Automobile Leasing, Aircraft Leasing', 'regulatory_relationship': 'Leases Receivable is governed by the Financial Accounting Standards Board (FASB) under the accounting standard ASC 842 for lease accounting.', 'accounting_standards_information': 'Under ASC 842, lessors are required to recognize lease receivables for the lease payments they expect to receive over the lease term.'}",Assets,Balance Sheet
. . . A/R from employees,4,Dr,A/R from employees,"{""what_it's_for"": 'This account is used to track amounts that are owed to the company by its employees. This could be due to advances, loans, or other forms of credit extended to the employees.', 'main_industries': 'This account can be used in any industry but is more common in industries where employee advances or loans are common, such as in the financial services, retail, and hospitality industries.', 'regulatory_relationship': ""This account is subject to the company's internal controls and policies, as well as any applicable local, state, and federal laws and regulations regarding employee advances and loans."", 'accounting_standards_information': 'Under the Generally Accepted Accounting Principles (GAAP), this account is considered a receivable and should be recorded at the amount the company expects to collect.'}",Assets,Balance Sheet
. . . Non-profit organization receivables from members,4,Dr,Non-profit organization receivables from members,"{""what_it's_for"": 'This account represents the amount of money that members owe to the non-profit organization for services provided or dues that are yet to be paid.', 'main_industries': 'Non-profit organizations, Membership organizations, Associations', 'regulatory_relationship': 'This account is regulated by the Financial Accounting Standards Board (FASB) in the United States, specifically under the Not-for-Profit Entities Topic (ASC 958).', 'accounting_standards_information': 'The receivables should be recognized when the organization has rights to receive the money, and it should be measured at fair value at the date of promise. Any uncollectible amounts should be written off as bad debts.'}",Assets,Balance Sheet
. . Inventories,3,-,Inventories,"{""what_it's_for"": ""Inventories represent the value of raw materials, work-in-progress goods and completely finished goods that are considered to be the portion of a business's assets that are ready or will be ready for sale."", 'main_industries': 'Manufacturing, Retail, Wholesale, Automotive, Food and Beverage', 'regulatory_relationship': 'Inventories are regulated by the International Financial Reporting Standards (IFRS) and Generally Accepted Accounting Principles (GAAP). They are usually valued at cost or net realizable value, whichever is lower.', 'accounting_standards_information': 'Inventories are accounted for in IAS 2 under IFRS and in ASC 330 under US GAAP.'}",Assets,Balance Sheet
. . . Unspecified Inventory,4,Dr,Unspecified Inventory,"{""what_it's_for"": 'This account is used to record the value of inventory items that have not been specifically classified into categories such as raw materials, work-in-progress, or finished goods. It can include any type of inventory that a company has in stock but has not yet classified or allocated to a specific use.', 'main_industries': 'This account is primarily used in industries that maintain a large variety of inventory items, such as manufacturing, retail, and wholesale industries.', 'regulatory_relationship': ""The value of the Unspecified Inventory account can affect the calculation of a company's Cost of Goods Sold (COGS) and therefore its taxable income. It is therefore subject to regulation by tax authorities."", 'accounting_standards_information': 'Under both IFRS and US GAAP accounting standards, companies are required to measure inventory at the lower of cost or net realizable value. This includes inventory items recorded in the Unspecified Inventory account.'}",Assets,Balance Sheet
. . . Inventory of goods for sale,4,Dr,Inventory of goods for sale,"{""what_it's_for"": 'This account is used to record the value of goods that a company has in its possession and intends to sell as part of its regular business operations.', 'main_industries': 'Retail, Manufacturing, Wholesale, E-commerce', 'regulatory_relationship': 'Inventory valuation is regulated by the Generally Accepted Accounting Principles (GAAP) and International Financial Reporting Standards (IFRS). It is subject to periodic inventory audits.', 'accounting_standards_information': 'Inventory is initially measured at cost. After initial recognition, inventory is measured at the lower of cost and net realizable value.'}",Assets,Balance Sheet
. . . Inventory of parts and supplies,4,Dr,Inventory of parts and supplies,"{""what_it's_for"": 'This account is used to track the value of parts and supplies that a company has in its inventory. These could be items that are used in the production process or that are sold directly to customers.', 'main_industries': 'Manufacturing, Retail, Automotive, Construction, Healthcare', 'regulatory_relationship': 'Inventory is regulated under the International Financial Reporting Standards (IFRS) and Generally Accepted Accounting Principles (GAAP). It is subject to periodic inventory counts and valuation adjustments.', 'accounting_standards_information': 'Under both IFRS and GAAP, inventory is initially measured at cost. After initial recognition, companies may choose to measure inventories at either cost or net realizable value, whichever is lower.'}",Assets,Balance Sheet
