account_name_level,level,balance,account_name,account_description,account_type,financial_statement_type
. Long-term financial assets,2,-,Long-term financial assets,"{""what_it's_for"": 'Long-term financial assets are investments that a company intends to hold for more than one year. They can include stocks, bonds, real estate, and other forms of investments that are not expected to be converted into cash within one year.', 'main_industries': 'This account can be used for various industries such as banking, insurance, investment firms, real estate, and any other industry that makes long-term investments.', 'regulatory_relationship': 'Long-term financial assets are regulated by the Financial Accounting Standards Board (FASB) and the International Financial Reporting Standards (IFRS).', 'accounting_standards_information': 'According to both FASB and IFRS, long-term financial assets should be initially recognized at cost and subsequently measured at fair value. Any changes in fair value should be recognized in profit or loss.'}",Assets,Balance Sheet
. . (l-t) Due from shareholders/directors/partners/members,3,-,(l-t) Due from shareholders/directors/partners/members,"{""what_it's_for"": 'This account represents amounts owed to the company by its shareholders, directors, partners, or members. These are typically short-term or long-term loans or advances that the company has made to these individuals or entities.', 'main_industries': 'This account is commonly used in all industries, but is particularly prevalent in closely-held or family-owned businesses, partnerships, and cooperatives where there may be more transactions between the company and its owners or managers.', 'regulatory_relationship': 'This account is subject to the same regulatory requirements as other receivables and loans. Depending on the jurisdiction, there may be additional requirements or restrictions on transactions between a company and its owners or managers.', 'accounting_standards_information': 'Under most accounting standards, amounts due from shareholders, directors, partners, or members should be recorded at their exchange amount at the time of the transaction. They should be presented separately on the balance sheet and any impairment should be recognized in profit or loss.'}",Assets,Balance Sheet
. . . (l-t) Due from unspecified related parties,4,Dr,(l-t) Due from unspecified related parties,"{""what_it's_for"": 'This account is used to record amounts that are owed to the company by related parties. These could be entities like parent companies, subsidiaries, affiliates, or key management personnel.', 'main_industries': 'This account is commonly used in industries with complex corporate structures such as manufacturing, real estate, and finance.', 'regulatory_relationship': ""The account is subject to regulatory scrutiny to ensure transactions are conducted at arm's length and not used for fraudulent purposes."", 'accounting_standards_information': 'Under both IFRS and US GAAP, companies are required to disclose the nature and amount of transactions with related parties.'}",Assets,Balance Sheet
. . . (l-t) Due from shareholders/directors,4,Dr,(l-t) Due from shareholders/directors,"{""what_it's_for"": 'This account represents amounts owed to the company by its shareholders or directors. It typically arises when shareholders or directors borrow from the company or when the company makes payments on behalf of them.', 'main_industries': 'This account can be used in any industry but is more common in closely held or family-owned businesses where transactions between the company and its owners or directors are more frequent.', 'regulatory_relationship': 'The account is subject to the same regulatory scrutiny as other receivable accounts. It may attract additional attention in audits due to the related party nature of the transactions.', 'accounting_standards_information': 'Under most accounting standards, amounts due from shareholders or directors should be disclosed separately in the notes to the financial statements. They should be measured at amortized cost less any provision for impairment.'}",Assets,Balance Sheet
. . . (l-t) Due from individual shareholders,4,Dr,(l-t) Due from individual shareholders,"{'what_it_is_for': 'This account represents the amount of money that individual shareholders owe to the company. It is typically used when shareholders have received money from the company and have not yet repaid it.', 'main_industries': 'This account can be used in any industry, but is most commonly found in corporations with individual shareholders, such as the technology, manufacturing, and retail industries.', 'regulatory_relationship': 'This account is regulated by the Financial Accounting Standards Board (FASB) and the International Financial Reporting Standards (IFRS). It must be reported in accordance with Generally Accepted Accounting Principles (GAAP).', 'accounting_standards_information': 'This account is subject to the accounting standards set forth by the FASB and IFRS. It must be reported accurately and in a timely manner to ensure compliance with these standards.'}",Assets,Balance Sheet
. . . (l-t) Due from corporate shareholders,4,Dr,(l-t) Due from corporate shareholders,"{'what_it_is_for': 'This account represents the amount of money that corporate shareholders owe to the company. It is typically used when shareholders have borrowed money from the company or have not yet paid in full for their shares.', 'main_industries': 'This account is commonly used in industries where companies have corporate shareholders, such as manufacturing, technology, and finance.', 'regulatory_relationship': 'This account is regulated by the Financial Accounting Standards Board (FASB) in the United States and by the International Financial Reporting Standards (IFRS) internationally.', 'accounting_standards_information': 'Under both FASB and IFRS, amounts due from corporate shareholders are considered assets because they represent a future economic benefit to the company.'}",Assets,Balance Sheet
. . . (l-t) Due from directors,4,Dr,(l-t) Due from directors,"{""what_it's_for"": 'This account represents the amount of money owed to the company by its directors. It is typically used when directors have borrowed money from the company or have made purchases on behalf of the company that they have yet to reimburse.', 'main_industries': 'This account can be used in any industry, but is most commonly found in corporations where directors may have financial transactions with the company.', 'regulatory_relationship': 'This account is subject to the rules and regulations of the relevant accounting and corporate governance bodies. In some jurisdictions, transactions between a company and its directors may be subject to additional scrutiny and disclosure requirements.', 'accounting_standards_information': 'Under most accounting standards, amounts due from directors should be disclosed separately in the financial statements and may need to be assessed for impairment.'}",Assets,Balance Sheet
. . . (l-t) Due from members/partners,4,Dr,(l-t) Due from members/partners,"{""what_it's_for"": ""This account represents the amounts owed to the company by its members or partners. It's typically used when members or partners have borrowed money from the company or have made purchases on the company's behalf."", 'main_industries': 'This account is commonly used in industries like partnerships, cooperatives, and other businesses where there are members or partners who may owe money to the company.', 'regulatory_relationship': 'This account is regulated by the Generally Accepted Accounting Principles (GAAP) and the International Financial Reporting Standards (IFRS).', 'accounting_standards_information': 'Under both GAAP and IFRS, amounts due from members or partners should be recorded as assets, as they represent amounts that the company expects to receive in the future.'}",Assets,Balance Sheet
. . . (l-t) Due from limited partners,4,Dr,(l-t) Due from limited partners,"{'what_it_is_for': 'This account represents the amount of money that is owed to the company by its limited partners. It is typically used when the partners have taken more money out of the company than they have contributed.', 'main_industries': 'This account is primarily used in industries that have partnerships such as law firms, accounting firms, and investment firms.', 'regulatory_relationship': 'This account is regulated by the Financial Accounting Standards Board (FASB) and the International Financial Reporting Standards (IFRS).', 'accounting_standards_information': 'According to the Generally Accepted Accounting Principles (GAAP), this account should be recorded as an asset because it represents a future economic benefit.'}",Assets,Balance Sheet
. . . (l-t) Due from members that are partnerships,4,Dr,(l-t) Due from members that are partnerships,"{""what_it's_for"": 'This account represents the amount of money owed to the company by its members that are partnerships. This could be due to a variety of reasons such as loans given, services provided, or expenses paid on behalf of the partnerships.', 'main_industries': 'This account is primarily used in industries where companies have partnerships as members, such as investment firms, law firms, and real estate firms.', 'regulatory_relationship': 'This account is regulated by the Financial Accounting Standards Board (FASB) and the International Financial Reporting Standards (IFRS).', 'accounting_standards_information': 'According to both FASB and IFRS, this account should be reported at the net realizable value, which is the amount that is expected to be collected.'}",Assets,Balance Sheet
. . . (l-t) Due from general partners,4,Dr,(l-t) Due from general partners,"{'what_it_is_for': 'This account represents the amount of money that general partners owe to the company. It is typically used when the partners have taken more than their share of profits, or have not contributed enough capital.', 'main_industries': 'This account is primarily used in industries with partnership structures, such as law firms, accounting firms, and private equity firms.', 'regulatory_relationship': 'This account is regulated by the partnership agreement and the general laws of the jurisdiction in which the partnership operates.', 'accounting_standards_information': 'Under both IFRS and US GAAP, this account is considered a receivable and should be recorded at fair value.'}",Assets,Balance Sheet
. . . (l-t) Due from other members,4,Dr,(l-t) Due from other members,"{""what_it's_for"": 'This account represents the amount of money owed to the company by other members or entities within the same group. It is typically used when there are intercompany transactions.', 'main_industries': 'This account is commonly used in industries with multiple entities or subsidiaries such as conglomerates, holding companies, and financial institutions.', 'regulatory_relationship': 'This account is subject to the rules and regulations of the Financial Accounting Standards Board (FASB) and the International Financial Reporting Standards (IFRS) which govern intercompany transactions and balances.', 'accounting_standards_information': 'Under both FASB and IFRS, companies are required to eliminate these balances in their consolidated financial statements to avoid double counting of assets and liabilities.'}",Assets,Balance Sheet
. . (l-t) Due from/investments in related parties,3,-,(l-t) Due from/investments in related parties,"{'what_it_is_for': 'This account is used to record amounts due from or investments in related parties. These could be entities that are related through common ownership or control. It could include amounts due from affiliates, subsidiaries, or parent companies.', 'main_industries': 'This account is commonly used in industries such as manufacturing, real estate, financial services, and any industry where there are complex corporate structures with related entities.', 'regulatory_relationship': 'The account is regulated by the Financial Accounting Standards Board (FASB) in the US, and by the International Financial Reporting Standards (IFRS) internationally. It is subject to disclosure requirements to ensure transparency about the nature and amounts of transactions with related parties.', 'accounting_standards_information': 'Under both FASB and IFRS, transactions with related parties need to be disclosed and may need to be recorded at fair value, rather than transaction value.'}",Assets,Balance Sheet
. . . (l-t) Due from/investments in related parties,4,Dr,(l-t) Due from/investments in related parties,"{'what_it_is_for': 'This account is used to record amounts due from or investments in related parties. These could be entities that are related through common ownership or control. It could include amounts due from affiliates, subsidiaries, or parent companies.', 'main_industries': 'This account is commonly used in industries such as manufacturing, real estate, financial services, and any industry where there are complex corporate structures with related entities.', 'regulatory_relationship': 'The account is regulated by the Financial Accounting Standards Board (FASB) in the US, and by the International Financial Reporting Standards (IFRS) internationally. It is subject to disclosure requirements to ensure transparency about the nature and amounts of transactions with related parties.', 'accounting_standards_information': 'Under both FASB and IFRS, transactions with related parties need to be disclosed and may need to be recorded at fair value, rather than transaction value.'}",Assets,Balance Sheet
. . Long-term investments,3,-,Long-term investments,"{""what_it's_for"": 'Long-term investments, also known as non-current investments, are investments that a company intends to hold for more than a year. They can include bonds, stocks, real estate, and more. These investments are expected to provide returns over a long period of time.', 'main_industries': 'Banking, Insurance, Real Estate, Manufacturing, and Investment Firms', 'regulatory_relationship': ""Long-term investments are regulated under the International Financial Reporting Standards (IFRS) and Generally Accepted Accounting Principles (GAAP). They must be reported on a company's financial statements and are subject to audit."", 'accounting_standards_information': 'Under IFRS and GAAP, long-term investments must be initially recognized at cost and subsequently measured at fair value. Any changes in fair value are usually recognized in profit or loss.'}",Assets,Balance Sheet
. . . Unspecified long-term investment,4,Dr,Unspecified long-term investment,"{""what_it's_for"": 'This account is used to record investments that a company plans to hold for more than one year but does not specify in what type of securities or assets. These could be investments in stocks, bonds, real estate, or other companies.', 'main_industries': 'This account is commonly used in industries such as banking, insurance, real estate, and any other industry that makes long-term investments.', 'regulatory_relationship': 'This account is regulated by the Financial Accounting Standards Board (FASB) and the International Financial Reporting Standards (IFRS).', 'accounting_standards_information': 'According to both FASB and IFRS, these investments should be recorded at fair value on the balance sheet. Any changes in fair value should be recognized in other comprehensive income.'}",Assets,Balance Sheet
. . . Foreign shares and investments,4,Dr,Foreign shares and investments,"{""what_it's_for"": 'This account is used to record the value of shares and investments in foreign companies that a company owns. It includes both equity and debt investments.', 'main_industries': 'This account is primarily used by companies in the Financial Services industry, such as banks and investment firms, but can also be used by any company that makes foreign investments.', 'regulatory_relationship': 'The valuation and reporting of foreign shares and investments are subject to regulations in both the home country and the foreign country. These regulations may include requirements for fair value measurement, impairment testing, and foreign currency translation.', 'accounting_standards_information': 'Under both IFRS and US GAAP, foreign shares and investments are initially recognized at cost and subsequently measured at fair value. Changes in fair value are generally recognized in profit or loss, but some changes may be recognized in other comprehensive income.'}",Assets,Balance Sheet
. . . (l-t) Shares,4,Dr,(l-t) Shares,"{""what_it's_for"": 'This account is used for recording the long-term investments in shares or stocks. It represents the value of shares that a company owns in another company and plans to hold for more than one year.', 'main_industries': 'This account is commonly used in industries such as Investment Firms, Financial Institutions, and Holding Companies.', 'regulatory_relationship': 'The account is regulated by the Securities and Exchange Commission (SEC) and must comply with the Generally Accepted Accounting Principles (GAAP) or International Financial Reporting Standards (IFRS), depending on the jurisdiction.', 'accounting_standards_information': 'Under both GAAP and IFRS, long-term investments in shares are initially recorded at cost and subsequently measured at fair value with changes recognized in other comprehensive income.'}",Assets,Balance Sheet
. . . Government debt,4,Dr,Government debt,"{""what_it's_for"": 'Government debt refers to the amount of money that the government has borrowed. It is used to finance budget deficits, make investments, and meet other financial obligations.', 'main_industries': 'This account is primarily used in the public sector, including federal, state, and local governments. It can also be relevant for financial institutions, investment firms, and any industry dealing with government securities.', 'regulatory_relationship': 'Government debt is regulated by various government agencies, including the Treasury Department in the U.S. It is also subject to various laws and regulations related to public finance and debt management.', 'accounting_standards_information': 'In terms of accounting standards, government debt is typically accounted for in accordance with governmental accounting standards, such as those set forth by the Governmental Accounting Standards Board (GASB) in the U.S.'}",Liabilities,Balance Sheet
. . . Corporate debt,4,Dr,Corporate debt,"{""what_it's_for"": 'Corporate debt refers to the amount of money that a company owes to its creditors. This can include bonds, loans, and other forms of debt.', 'main_industries': 'This account is applicable to all industries, but is particularly relevant for industries with high capital expenditures such as manufacturing, utilities, and telecommunications.', 'regulatory_relationship': ""Corporate debt is regulated by various financial authorities depending on the jurisdiction. It is subject to disclosure requirements and may impact a company's credit rating."", 'accounting_standards_information': 'Under both IFRS and US GAAP, corporate debt is recorded at its initial recognition at fair value and subsequently measured at amortized cost using the effective interest method.'}",Liabilities,Balance Sheet
. . . Securities,4,Dr,Securities,"{""what_it's_for"": 'Securities are financial instruments, such as stocks or bonds, that represent an ownership interest in a publicly-traded corporation or a governmental body. They can be bought, sold, or held for investment.', 'main_industries': 'Securities are used across a wide range of industries, but are particularly relevant in the financial services industry, including banking, investment services, and insurance.', 'regulatory_relationship': 'Securities are heavily regulated by governmental bodies such as the Securities and Exchange Commission in the U.S. or the Financial Conduct Authority in the U.K.', 'accounting_standards_information': 'Under both U.S. GAAP and IFRS, securities can be classified as held-to-maturity, available-for-sale, or trading securities, each with its own accounting treatment.'}",Assets,Balance Sheet
. . Long-term loans,3,-,Long-term loans,"{""what_it's_for"": 'Long-term loans are loans that are due more than one year from the current date. They are used to finance long-term investments, major capital improvements, or the purchase of fixed assets such as buildings or machinery.', 'main_industries': 'This account can be used in various industries including manufacturing, real estate, construction, and any other industry that requires significant capital investment.', 'regulatory_relationship': 'Long-term loans are subject to various regulations depending on the jurisdiction. These may include restrictions on interest rates, loan terms, and disclosure requirements.', 'accounting_standards_information': 'Under International Financial Reporting Standards (IFRS) and Generally Accepted Accounting Principles (GAAP), long-term loans are recorded on the balance sheet at their present value, and interest expense is recognized over the term of the loan.'}",Liabilities,Balance Sheet
. . . Unspecified long-term loans,4,Dr,Unspecified long-term loans,"{'what_it’s_for': 'Unspecified long-term loans are loans that a company has taken out and must repay over a period longer than one year. These loans are typically used for significant investments or expenditures.', 'main_industries': 'This account can be used in various industries, including manufacturing, real estate, construction, and any industry that requires significant capital investment.', 'regulatory_relationship': 'Long-term loans must be reported in accordance with the Generally Accepted Accounting Principles (GAAP) and International Financial Reporting Standards (IFRS).', 'accounting_standards_information': 'Under both GAAP and IFRS, long-term loans are reported as liabilities on the balance sheet. They are initially recorded at the amount received, and over time, the carrying amount is increased to reflect any accrued interest.'}",Liabilities,Balance Sheet
. . . Mortgage assets,4,Dr,Mortgage assets,"{""what_it's_for"": 'Mortgage assets represent the loans that a company or financial institution has issued to individuals or businesses for the purchase of real estate. These assets generate income in the form of interest payments.', 'main_industries': 'This account is primarily used in the banking, financial services, and real estate industries.', 'regulatory_relationship': 'Mortgage assets are heavily regulated by financial authorities to ensure fair lending practices. They are subject to various laws and regulations, including the Truth in Lending Act (TILA) and the Real Estate Settlement Procedures Act (RESPA).', 'accounting_standards_information': 'Under the Generally Accepted Accounting Principles (GAAP) and International Financial Reporting Standards (IFRS), mortgage assets are typically classified as long-term assets and are recorded at their fair value on the balance sheet.'}",Assets,Balance Sheet
. . . Personal and credit card loans,4,Dr,Personal and credit card loans,"{'what_it’s_for': 'This account is used to record the amount of money that individuals have borrowed from the company through personal and credit card loans. It includes both the principal amount of the loan and any accrued interest.', 'main_industries': 'This account is primarily used in the banking, financial services, and credit card industries.', 'regulatory_relationship': 'This account is regulated by various financial authorities depending on the jurisdiction, such as the Financial Conduct Authority in the UK or the Consumer Financial Protection Bureau in the US. It must also comply with the relevant accounting standards for financial instruments, such as IFRS 9 or US GAAP.', 'accounting_standards_information': 'Under IFRS 9, this account would be classified as a financial asset and measured at amortized cost, subject to impairment. Under US GAAP, it would be classified as a receivable and measured at the net realizable value.'}",Assets,Balance Sheet
. . . Business and government loans,4,Dr,Business and government loans,"{""what_it's_for"": 'This account is used to record the amount of loans given out to businesses and government entities. It represents the amount of money that is expected to be paid back to the company.', 'main_industries': 'This account is mainly used in the banking, financial services, and public sector industries.', 'regulatory_relationship': 'This account is regulated by the Financial Accounting Standards Board (FASB) and the International Financial Reporting Standards (IFRS), which provide guidelines on how to account for loans and interest income.', 'accounting_standards_information': 'According to both FASB and IFRS, loans should be recorded at their fair value at the time of issuance. Any subsequent changes in the value of the loan due to changes in interest rates or credit risk should be reflected in the financial statements.'}",Assets,Balance Sheet
. . . Line of credit,4,Dr,Line of credit,"{""what_it's_for"": ""A line of credit is a flexible loan from a bank or financial institution. It's a source of funds that can be borrowed, repaid, and borrowed again. It can be used to manage a company's cash flow, finance operations or purchase inventory."", 'main_industries': 'Retail, Manufacturing, Construction, Service Industries', 'regulatory_relationship': 'Regulated by the Financial Conduct Authority (FCA) and subject to the terms and conditions of the lending institution.', 'accounting_standards_information': 'Under IFRS and US GAAP, a line of credit is classified as a liability. Interest expense is recognized in the period it is incurred.'}",Liabilities,Balance Sheet
